streamer_name,videoId,title,description,publishedAt
御伽原江良,wLK57h3hlPg,【にじさんじ×ユニゾンリーグ】ガブリエラがゲームとコラボ！？【御伽原江良/童田明治】,コラボ名称 : にじさんじ×ユニゾンリーグコラボ 開催期間 : 2020年10月14日（水）17:00 ～ 2020年10月31日（土）22:59 ▽アプリダウンロード ...,2020-10-14T14:25:41Z
御伽原江良,rNUcJc9EMAI,ツイステに殺された女,ツイチャン終わったら始めます ただの雑談.,2020-10-04T13:47:07Z
御伽原江良,lDAz51Fy5d0,【カラオケ練習】GOMIKASU-Original Mix-【off vocal】,なんかまた届きました on vocal(？) → https://youtu.be/hw8whKP0HdU チバニャン→https://twitter.com/ChibaNyan_dayo?s=20 ◯リンク 【Twitter】 ...,2020-09-17T12:00:21Z
御伽原江良,dvo1PhD8yME,【デレステ】幸子の５週目が来ました【御伽原江良】,ｶﾜｲｲﾈ！ リンク 【Twitter】 https://twitter.com/OtogibaraEra #御伽原江良 #御伽の国の舞踏会 でツイートしてね！ 【メンバーシップ】 ...,2020-09-14T16:05:34Z
御伽原江良,q9W5zIyiISI,【ツイステガチャ】ジャミルの誕生日なので御祝儀代わりにガチャ回します【御伽原江良】,ジャミルおめでとう；； ◯リンク 【Twitter】 https://twitter.com/OtogibaraEra #御伽原江良 #御伽の国の舞踏会 でツイートしてね！ 【メンバーシップ】 ...,2020-09-12T13:30:14Z
御伽原江良,72cxmCHaRpY,シンデレラフェスってなんでしたっけ？【御伽原江良】,追記：爆死じゃなかったかも 24時間生放送見ながら編集してたんですけど見入って全然集中できませんでした。最高でした。 俺を〇せ。 ◯リンク 【Twitter】 ...,2020-09-06T13:00:14Z
御伽原江良,UTZoBj9EfXc,１時だし一位取りたいな～みたいな,見るな ◯リンク 【Twitter】 https://twitter.com/OtogibaraEra #御伽原江良 #御伽の国の舞踏会 でツイートしてね！ 【メンバーシップ】 ...,2020-09-05T17:07:05Z
御伽原江良,U3HkBRJtWtw,フォールガイ〇【御伽原江良/にじさんじ】,以前メンバー限定配信でやったやつの切り抜き(内容ほぼノーカット)です ◯リンク 【Twitter】 https://twitter.com/OtogibaraEra #御伽原江良 #御伽の国の舞踏会 でツイートし ...,2020-08-16T14:00:09Z
御伽原江良,f32nqhj-TLU,【ツイステガチャ】推しを完凸させました【御伽原江良】,マジで推しのガチャにはなにかしらのヤバい物質が入ってる ◯リンク 【Twitter】 https://twitter.com/OtogibaraEra #御伽原江良 #御伽の国の舞踏会 でツイートしてね！,2020-08-09T13:30:14Z
御伽原江良,FLqeds8f_5k,【ツイステガチャ】ハートのエースが出てこない【御伽原江良/にじさんじ】,後半まだかな、ケイトPUまだかな ◯リンク 【Twitter】 https://twitter.com/OtogibaraEra #御伽原江良 #御伽の国の舞踏会 でツイートしてね！ 【petit fleurs公式HP】 ...,2020-07-09T13:00:14Z
御伽原江良,H-nZ8ezR0fE,様子がおかしいシンデレラフェス【御伽原江良/にじさんじ】,語りすぎてて気持ち悪くて沢山カットしました メンバー限定配信ノーカット版→https://youtu.be/pu0-eiDDT6I メシウマ限定はーちゃん→https://youtu.be/iGTJkFpiqy8 ...,2020-07-05T13:00:11Z
御伽原江良,daFEzh0sutc,Twitterでバズったぴえんのホラゲvsホラゲとぴえんが世界一嫌いな私【御伽原江良/にじさんじ】,ぴえん ※最初の話（顔が全く動かなかった為顔がない）プラス画質悪いのが治らなかったので画質がゴミです。すみません。 ◯リンク 【Twitter】 ...,2020-06-21T13:00:10Z
御伽原江良,hw8whKP0HdU,GOMIKASU-Original Mix-（御伽原江良vsチバニャン),なんで本気出してしまったん？,2020-06-21T11:00:14Z
御伽原江良,uVem59jLb7E,理解力が乏しいアソビ大全51【御伽原江良/にじさんじ】,アソビ大全であそびたいぜ～っつってなｗ ◯リンク 【Twitter】 https://twitter.com/OtogibaraEra #御伽原江良 #御伽の国の舞踏会 でツイートしてね！ 【petit fleurs公式HP】 ...,2020-06-14T14:00:13Z
御伽原江良,A3_WlxF4Xls,【ツイステガチャ】回すつもりじゃなかったガラ【御伽原江良/にじさんじ】,本当はマリッジが本命だからガラレオナスルーのつもりだったんですよ。ええ。 6万のカリムくん→https://youtu.be/X4sZHpYwVNk マジ病み ...,2020-06-11T13:00:15Z
御伽原江良,EONBj-v33v4,ギバラ ~バズり動画＆切り抜きまとめ~,お友達に布教するときにでも使ってください 〇動画リンク 念願のちゃちゃまるに遭遇したVtuber ...,2020-06-07T13:00:11Z
御伽原江良,elLP8SvIf30,【ツイステガチャ】マジ病みジャミルピックアップ【御伽原江良/にじさんじ】,この動画は四章を読んだ後にとったものです。だいぶ精神にきました 前回のカリムガチャ→https://youtu.be/X4sZHpYwVNk 次回の ...,2020-06-03T12:30:14Z
御伽原江良,vpXP_fWyz5A,ラムのラブソング / 御伽原江良 (petit fleurs)【cover】,『私がいつでもいちばん』 作詞：伊藤アキラ 作曲：小林泉美 編曲：渡辺剛 Illustration： ぱん Twitter： https://twitter.com/panno_mimi ...,2020-05-26T13:00:14Z
御伽原江良,kxNAljhLEV8,旅行券1000枚で住民厳選臨んだら奇跡起きた【御伽原江良/にじさんじ】,すごくびっくりしました（小並感） ◯リンク 【Twitter】 https://twitter.com/OtogibaraEra #御伽原江良 #御伽の国の舞踏会 でツイートしてね！ 【petit fleurs公式HP】 ...,2020-05-22T12:00:12Z
御伽原江良,AYbXWrdlJag,驚愕の１０００連 ジャック・ビンタガチャ【御伽原江良/にじさんじ】,さすがに1000枚もあれば行けるやろ～ｗ ◯リンク 【Twitter】 https://twitter.com/OtogibaraEra #御伽原江良 #御伽の国の舞踏会 でツイートしてね！ 【petit fleurs公式HP】 ...,2020-05-21T18:32:24Z
御伽原江良,X80uQt5r4_w,あつまれ マイル旅行券【御伽原江良/にじさんじ】,リンク 【Twitter】 https://twitter.com/OtogibaraEra #御伽原江良 #御伽の国の舞踏会 でツイートしてね！ 【petit fleurs公式HP】 https://nbcuni-music.com/petit_fleurs/ 1st ...,2020-05-20T20:00:15Z
御伽原江良,X4sZHpYwVNk,【ツイステガチャ】６万円のカリムくん【御伽原江良/にじさんじ】,スカラビアの民なので多分そろそろ死にます ◯リンク 【Twitter】 https://twitter.com/OtogibaraEra #御伽原江良 #御伽の国の舞踏会 でツイートしてね！ 【petit fleurs ...,2020-05-17T11:00:21Z
御伽原江良,lZNajntP3jI,無視しまくった人気住民を当てろ！！呪いの住民厳選【御伽原江良/にじさんじ】,怒ってそう ◯リンク 【Twitter】 https://twitter.com/OtogibaraEra #御伽原江良 #御伽の国の舞踏会 でツイートしてね！ 【petit fleurs公式HP】 ...,2020-05-04T17:05:11Z
御伽原江良,txtNfw6tL54,涙の５００連ちゃちゃまるごめんなさいもう浮気しませんガチャ【御伽原江良/にじさんじ】,ちゃちゃまるううううううううううううううう；；；；；；；；； ◯リンク 【Twitter】 https://twitter.com/OtogibaraEra #御伽原江良 #御伽の国の舞踏会 でツイートしてね！ 【petit fleurs ...,2020-04-30T19:19:33Z
御伽原江良,j8j8n57mpn0,驚異の６００連ちゃちゃまるガチャ【御伽原江良/にじさんじ】,絶対にお迎えするわよ ◯リンク 【Twitter】 https://twitter.com/OtogibaraEra #御伽原江良 #御伽の国の舞踏会 でツイートしてね！ 【petit fleurs公式HP】 ...,2020-04-29T17:07:54Z
御伽原江良,jUTu6mjoYhU,住民厳選準備マイル旅行券ひったくり配信【御伽原江良/にじさんじ】,ぴえんひつじが欲しいねん ◯リンク 【Twitter】 https://twitter.com/OtogibaraEra #御伽原江良 #御伽の国の舞踏会 でツイートしてね！ 【petit fleurs公式HP】 ...,2020-04-28T18:25:22Z
御伽原江良,zksafMC8dhE,音割れマリオカート【御伽原江良/にじさんじ】,神プレイすぎて怖い。喉痛い。 ◯リンク 【Twitter】 https://twitter.com/OtogibaraEra #御伽原江良 #御伽の国の舞踏会 でツイートしてね！ 【petit fleurs公式HP】 ...,2020-04-27T12:15:06Z
御伽原江良,IXGtjtgLST4,【ボンバーマンR】ぴえんリベンジ【御伽原江良/にじさんじ】,やり方を知ろうの会 ◯リンク 【Twitter】 https://twitter.com/OtogibaraEra #御伽原江良 #御伽の国の舞踏会 でツイートしてね！ 【petit fleurs公式HP】 ...,2020-04-24T15:26:00Z
御伽原江良,ph0U8REqc2o,【初トレバ！！！】ぬいぐるみをささっとゲットして優勝する【御伽原江良/にじさんじ】,UFOキャッチャー上手いから見ときや ◯リンク 【Twitter】 https://twitter.com/OtogibaraEra #御伽原江良 #御伽の国の舞踏会 でツイートしてね！ 【petit fleurs公式HP】 ...,2020-04-22T15:48:11Z
御伽原江良,TPDVrDq3sDg,【人生オワタの大冒険】tanasinnを倒した俺は最強【御伽原江良/にじさんじ】,余裕ｗ ◯リンク 【Twitter】 https://twitter.com/OtogibaraEra #御伽原江良 #御伽の国の舞踏会 でツイートしてね！ 【petit fleurs公式HP】 ...,2020-04-18T18:28:31Z
御伽原江良,KeDQRb39m58,【人生オワタの大冒険】初見殺し鬼畜ゲー持ってきたよ！！【御伽原江良/にじさんじ】,ゴミカスの再来～ ◯リンク 【Twitter】 https://twitter.com/OtogibaraEra #御伽原江良 #御伽の国の舞踏会 でツイートしてね！ 【petit fleurs公式HP】 ...,2020-04-16T17:43:49Z
御伽原江良,s0TFuGpeYuI,プロスリザリオ選手だけどなんか質問あるぅ？ｗ【御伽原江良/にじさんじ】,余裕よ 【動画】マジで普通に一位とりました 【Slither.io】→https://youtu.be/WG6gC4VeiMc ◯リンク 【Twitter】 https://twitter.com/OtogibaraEra #御伽原江良 #御伽の国の ...,2020-04-13T15:26:36Z
御伽原江良,WG6gC4VeiMc,マジで普通に一位とりました 【Slither.io】,めっちゃ長時間の撮影だったから私がいないけど許して ◯リンク 【Twitter】 https://twitter.com/OtogibaraEra #御伽原江良 #御伽の国の舞踏会 でツイートしてね！,2020-04-12T13:33:31Z
御伽原江良,rEiKvjvoUIc,リズムゲーの神とリングフィット芸人が合わさるとどうなるか知ってるか？【御伽原江良/にじさんじ】,多分死ぬ ◯リンク 【Twitter】 https://twitter.com/OtogibaraEra #御伽原江良 #御伽の国の舞踏会 でツイートしてね！ 【petit fleurs公式HP】 ...,2020-04-07T15:06:30Z
御伽原江良,loaJkuepWuk,初めてのどうぶつの森【御伽原江良/にじさんじ】,たぬきちがラスボスっていうのは知ってる ◯リンク 【Twitter】 https://twitter.com/OtogibaraEra #御伽原江良 #御伽の国の舞踏会 でツイートしてね！ 【petit fleurs公式HP】 ...,2020-04-06T15:32:31Z
御伽原江良,iGTJkFpiqy8,精神崩壊デレステガチャ【天井】,病院行ったほうがいいと思う。先日の配信のまとめです。 ほんへ→https://youtu.be/kJ6RZfoOio8 ◯リンク 【Twitter】 https://twitter.com/OtogibaraEra #御伽原江良 #御伽 ...,2020-04-06T07:00:24Z
御伽原江良,hRxm9C6u_c8,はい、この一か月半くらいの話でもしましょうかね【御伽原江良/にじさんじ】,完全って書いたけど完全ではないわ。 配信頻度減少の理由は話せません。 ◯リンク 【Twitter】 https://twitter.com/OtogibaraEra #御伽原江良 #御伽の国の舞踏会 で ...,2020-04-03T18:33:05Z
御伽原江良,kJ6RZfoOio8,【デレステガチャ】はーちゃんに先輩と呼ばれたいだけの豪運ワイｗ【御伽原江良/にじさんじ】,まあ出るやろ ◯リンク 【Twitter】 https://twitter.com/OtogibaraEra #御伽原江良 #御伽の国の舞踏会 でツイートしてね！ 【petit fleuls公式HP】 ...,2020-04-03T14:17:34Z
御伽原江良,Icdmw5xIXyU,【公式切り抜き】暴言マリオカート【御伽原江良/にじさんじ】,いちからの人が作ってくれました。 ほんへ→ 【視聴者参加型】暴言マリオカート＾＾【御伽原江良/にじさんじ】 https://youtu.be/BC2pyYFnm5E ◯リンク 【Twitter】 ...,2020-03-22T09:30:02Z
御伽原江良,TgSFTMo8YTo,【地獄】１周年なので初配信を見てみる【御伽原江良/にじさんじ】,今までで一番怖いかもしれない ◯リンク 【Twitter】 https://twitter.com/OtogibaraEra #御伽原江良 #御伽の国の舞踏会 【お問い合わせやプレゼントはこちら】 ...,2020-03-10T14:05:18Z
御伽原江良,7im50oUhrMA,【ガチャ配信】プリンス仁奈、待っててね。今大金もって迎えに行くからね。【御伽原江良/にじさんじ】,シンプル。出るまで回すのみ。 出るまで終わらないけど出ても即終了ではないです。 ◯リンク 【Twitter】 https://twitter.com/OtogibaraEra #御伽原江良 #御伽の国の舞踏会 ...,2020-03-02T14:53:49Z
御伽原江良,drAb24NBHh4,仲良くって書いてあるけど仲良くする気はないマリパ５【御伽原江良/笹木咲】,ボッチマリパ組コラボ。誘ってもらいました。 サムネ作ってくれたのが笹木さんだったから仲良くって書いてあるけど私はバチボコにバトるつもりです。 #笹木咲 【YouTube】 ...,2020-02-25T15:07:20Z
御伽原江良,BC2pyYFnm5E,【視聴者参加型】暴言マリオカート＾＾【御伽原江良/にじさんじ】,ボコボコにします ◯リンク 【Twitter】 https://twitter.com/OtogibaraEra #御伽原江良 #御伽の国の舞踏会 【お問い合わせやプレゼントはこちら】 ...,2020-02-24T15:16:35Z
御伽原江良,iP33nBv0hdY,Wii Party U なら余裕で勝てるのでは！ｗ【御伽原江良/にじさんじ】,リンク 【Twitter】 https://twitter.com/OtogibaraEra #御伽原江良 #御伽の国の舞踏会 【お問い合わせやプレゼントはこちら】 https://nijisanji.ichikara.co.jp/cont... 【公式 ...,2020-02-14T13:04:58Z
御伽原江良,3peekLclrRM,この想いは止められない【御伽原江良/にじさんじ】,んぁ ◯リンク 【Twitter】 https://twitter.com/OtogibaraEra #御伽原江良 #御伽の国の舞踏会 【お問い合わせやプレゼントはこちら】 https://nijisanji.ichikara.co.jp/cont.,2020-02-11T14:22:15Z
