streamer_name,videoId,title,description,publishedAt
月ノ美兎,Fphp9dRHtrE,ヌン！液タブでライバーをいっぱい描くわよ【にじさんじ/月ノ美兎】,ここで描いたイラストはいずれなにかに使われます！描いているライバーさんたちはそれに参加しているメンツです。 #みとの生放送 月ノ美兎のTwitter（配信予定等はこちら ...,2020-10-30T20:31:16Z
月ノ美兎,hM6cPYvu1lw,液タブでライバーをいっぱい描くわよ【にじさんじ/月ノ美兎】,ここで描いたイラストはいずれなにかに使われます！描いているライバーさんたちはそれに参加しているメンツです。 #みとの生放送 月ノ美兎のTwitter（配信予定等はこちら ...,2020-10-29T18:17:41Z
月ノ美兎,gU_azrO-h-E,【雑談】アイマスの案件を受けたり革命家と話した【にじさんじ/月ノ美兎】,わかりやすいタイトルだこと #みとの生放送 月ノ美兎のTwitter（配信予定等はこちらで呟いています！） https://twitter.com/MitoTsukino.,2020-10-28T13:24:07Z
月ノ美兎,Br0gZd_8emo,にじ×マジ  ~絶対にDLしないライバーVS絶対DLさせるライバー~,提供：マジカミ ↓DLはこちらから↓ https://app.adjust.com/epdtr27 司会：夢追翔 出演者：月ノ 美兎 笹木咲 魔界ノりりむ 卯月コウ でびでび・でびる ドーラ #にじマジ 月ノ ...,2020-10-25T12:57:01Z
月ノ美兎,8gDuxeMT2Vs,楓と美兎でリズム天国に昇る【にじさんじ/月ノ美兎/樋口楓】,昇天！！！ #楓と美兎 樋口楓のようつべ https://www.youtube.com/channel/UCsg-YqdqQ-KFF0LNk23BY4A 月ノ美兎のTwitter（配信予定等はこちらで呟いています！）,2020-10-20T14:21:29Z
月ノ美兎,2HlCrD__qPs,家から満身創痍の女騎士が召喚されてくる恋愛ゲームやる #最終回【にじさんじ/月ノ美兎】,わたくしはね、ある。 #みとの生放送 https://youtu.be/YsEMi4WYE0g ←前回 前回までのあらすじ：ある日フリーターのムーンオーク（本名）の家に魔法陣が現れ、満身創痍の ...,2020-10-19T14:49:40Z
月ノ美兎,EQ2IfeAcHJA,【#にじ宇宙人狼】深夜に裏切り者を探す会【にじさんじ/月ノ美兎】,「Among us」というゲームを、8人でプレイさせていただきます！ 今度こそ、最後まで生き残る！！！ルールは下記！ 【ルール】 宇宙船を舞台にミッション(タスク)をクリアし ...,2020-10-17T18:14:19Z
月ノ美兎,V6CpdKb8viI,メジャーデビューから歌手を知った人が最初に見る光景,初見向け 月ノ美兎のTwitter（配信予定等はこちらで呟いています！） https://twitter.com/MitoTsukino.,2020-10-17T09:43:35Z
月ノ美兎,YsEMi4WYE0g,家から満身創痍の女騎士が召喚されてくる恋愛ゲームやる #2【くっころでいず/にじさんじ/月ノ美兎】【にじさんじ/月ノ美兎】,みとの生放送 https://youtu.be/4_vFxzlBMN4 ←前回 次回→https://youtu.be/e7wUt4qtaPY 前回までのあらすじ：ある日フリーターのムーンオーク（本名）の家に魔法陣が ...,2020-10-13T14:10:00Z
月ノ美兎,4_vFxzlBMN4,家から満身創痍の女騎士が召喚されてくる恋愛ゲームやる【くっころでいず/にじさんじ/月ノ美兎】,開始時間→ 09:05 続き→ 10/13 21時生配信 https://youtu.be/YsEMi4WYE0g 月ノ美兎のTwitter（配信予定等はこちらで呟いています！）,2020-10-11T14:58:50Z
月ノ美兎,mkGN7jTRwfI,月ノ美兎「それゆけ！学級委員長」MV,月ノ美兎「それゆけ！学級委員長」Music Video 月ノ美兎1st Single 「それゆけ！学級委員長」 2020年10月7日（水）発売 □初回生産限定盤（CD紙ジャケット+ ...,2020-10-07T09:01:13Z
月ノ美兎,2Y_RQXRztkc,【#にじ宇宙人狼】疑い合い、はじめました【Among US/月ノ美兎】,にじ宇宙人狼 ルールは概要の下部にあります！ 「Among Us」日本語版MOD製作者様：そーわっと様 https://twitter.com/kabekezuri 日本語版MODの詳細はこちら↓ ...,2020-10-05T14:31:30Z
月ノ美兎,6JsK4WAkqF8,【クイズにじオネア】最初からいた奴が解けないわけなくない！？【にじさんじ/月ノ美兎】,がんばって人格分離して司会も回答者もやります。 #みとの生放送 Twitter→ https://twitter.com/MitoTsukino.,2020-10-04T11:21:32Z
月ノ美兎,OoVlCpAXBsQ,【新髪型お披露目】念願のポニーテール！！！！【にじさんじ/月ノ美兎】,でやアァアアｯ!!!!!!!!!!!!!!!!!!!!!!!!!!!!!!!!!!!!!!!!!! #みとの生放送.,2020-09-28T15:34:08Z
月ノ美兎,dBdDlEMX5oA,【マイクラ肝試し2020…？】 JK組タイムスリップで肝試し編【にじさんじ / 月ノ美兎視点】,肝試しワールドにお邪魔しています～～～！！！！ 本日は2014年時の肝試しに挑戦するよ！ 2020年→https://www.youtube.com/watch?v=Xp8iIHp13bE.,2020-09-27T15:43:13Z
月ノ美兎,9-5YfzGKwQY,【マイクラ肝試し2020】 JK組・七不思議を見つけよう編【にじさんじ / 月ノ美兎視点】,マイクラの「前川郷」ワールドに足を踏み入れたＪＫ組（月ノ美兎、樋口楓、静凛）。なにやら不気味ないわくつきの村だそうだが、どうやらここには世にも恐ろしい「七不思議」が ...,2020-09-26T16:59:22Z
月ノ美兎,Xp8iIHp13bE,【マイクラ肝試し2020】 JK組・肝試し編【にじさんじ / 月ノ美兎視点】,肝試しワールドにお邪魔しています～～～！！！！ 屋台廻り編はここ！ https://www.youtube.com/watch?v=r2FkGx5GNY0.,2020-09-25T15:04:10Z
月ノ美兎,r2FkGx5GNY0,【マイクラ肝試し2020】 JK組・屋台お廻り編【にじさんじ / 月ノ美兎視点】,肝試し本編まで、屋台の街並みを探索します！！！！ （序盤はｊｋ組歌ってみたの同時試聴してるわよ） ２２時からはここ！ 【マイクラ肝試し2020】 JK組・肝試し編【にじさんじ ...,2020-09-25T13:13:49Z
月ノ美兎,DUWbqT2CEYg,輪!Moon!dass!cry! / coverd by JK組（月ノ美兎・樋口楓・静凛）,アバンギャルドな時を刻め！！ ▽歌わせていただいた曲「輪!Moon!dass!cry!」 https://www.youtube.com/watch?v=BgpMj9vaK4c 作詞・作曲 : 山崎真吾さま ▽オケ制作 ...,2020-09-25T11:00:11Z
月ノ美兎,W9lWi7_3wUM,月ノ美兎・爆誕SP2020【ヨーロッパ企画実況・Wiki閲覧・凸待ち】,みとの生放送 今回は３本立てでお送りするわよォ〜 ・ヨーロッパ企画ゲーム実況 ・月ノ美兎のWiki閲覧 ・凸待ち 月ノ美兎のTwitter https://twitter.com/MitoTsukino.,2020-09-24T17:10:32Z
月ノ美兎,sj9Gkd7R36M,推しの夢を見たいあまり浮島ハゲになってしまったやべーやつ【切り抜き/月ノ美兎/にじさんじ】,元配信 https://www.youtube.com/watch?v=YtjhuBM8HiY 月ノ美兎のTwitter https://twitter.com/MitoTsukino.,2020-09-22T13:00:12Z
月ノ美兎,YtjhuBM8HiY,「夢で見た月ノ美兎」の目撃情報をお伝えします,みとの生放送 様々な「夢で見た月ノ美兎」の詳細が届きましたので、発表させていただきます。リスナーのみなさま、ライバーのみなさま、ご協力ありがとうございました。,2020-09-21T13:12:01Z
月ノ美兎,YxbGFYIjd1U,【雑談】新衣装の差分とか百物語含む最近の話とかの段,最近、雑談配信ににこじらせた音MAD作者みたいなタイトルをつけない実験をしています #みとの生放送.,2020-09-16T14:32:24Z
月ノ美兎,9CqaQMSNQng,【#帰れない百物語】100個怖い話するまで帰れない2020【月ノ美兎/にじさんじ】,終わりの時 何かが起こる #帰れない百物語 リスナーの皆様、バーチャルユーチューバーの皆様、たくさんのご応募ありがとうございました。 月ノ美兎のツイッター ...,2020-09-12T22:04:59Z
月ノ美兎,TEq0fwWopsk,NO DATA.20200913,https://www.youtube.com/watch?v=9CqaQMSNQng.,2020-09-11T09:00:17Z
月ノ美兎,qyIWjOSBr6c,【60万人耐久】チャンネル権限を巡って戦う【月ノ美兎】,かかってこいやアアアアアアッ!!!!!!!!!!!!!!!!!!!!!!!!!!!!!!!!!!!!!!!!!!!!!!! #みとの生放送 とあるオケを作ってくださった弦月藤士郎さん ...,2020-09-07T13:35:25Z
月ノ美兎,s9L-ViXn23M,【キャラリレー】月ノ美兎、声真似生主への第一歩【Fall Guys】,あらゆるキャラクターがFall Guysをリレープレイします。わたくしに任せてください。 #みとの生放送.,2020-09-01T14:14:07Z
月ノ美兎,esdzoKhju4M,♡　や　っ　た　ぁ　雑　談　♡,みとの生放送 雑談とかデビューCDのジャケット公開とか！！！ ツイッター https://twitter.com/MitoTsukino.,2020-08-26T13:25:47Z
月ノ美兎,TFDK2XCSzeI,【minecraft】お祭り行く〜ッ！！【にじさんじ鯖夏祭り2020/月ノ美兎】,ワクワクワクワクワクワクワクワクワクワクワクワクワクワクワクワクワクワクワクワクワクワクワクワクワクワク #にじ鯖夏祭り#みとの生放送.,2020-08-22T13:34:05Z
月ノ美兎,ZFP52EBVIik,よりぬき美兎ちゃん 咆哮編【4分】,わたくしのツイッターはこちらから！ https://twitter.com/MitoTsukino.,2020-08-21T12:45:38Z
月ノ美兎,Q3CcDwCy8iE,やさしい世界　【Fall Guys】【にじさんじ / 月ノ美兎】,"""わたくしにとって"" やさしい世界、目指します！ #みとの生放送.",2020-08-18T16:12:42Z
月ノ美兎,iSDrUefUPCI,おかめ仮面倒しに行く【影廊 -Shadow Corridor-/月ノ美兎/にじさんじ】,金の粒たべよ #みとの生放送 NintendoSwitch版「シャドーコリドー影の回廊」： https://ec.nintendo.com/JP/ja/titles/70010000021392 PC版「ShadowCorridor」： ...,2020-08-15T16:00:41Z
月ノ美兎,hQ1UvM-b0LI,【Prhythm☆StellA】月ノ美兎がバーチャルな女神系アイドルと対面【店舗体験】,この動画は『Prhythm☆StellA(プリズム☆ステラ) 』とのタイアップです！ ▽公式サイト(チケット予約)はこちら https://bit.ly/2EXd7QL ▽『Prhythm☆StellA(プリズム☆ ...,2020-08-13T12:31:13Z
月ノ美兎,7l4LABRlklo,ヤバいバーチャル新施設いった動画・世界規模の宝探し話【体験レポ/にじさんじ/月ノ美兎】,みとの生放送 ちなみにバーチャル新施設は、案件でめっちゃ早々に訪問させてもらったぞ！！ 訪問させてもらった「プリズムステラ」さん https://bit.ly/2EXd7QL.,2020-08-12T13:14:56Z
月ノ美兎,9loUT2_f3Oo,【凸待ち】にじさんじライバーの念能力を予想する会【にじさんじ/月ノ美兎/社築】,オタクは念能力の話をするのが大好き。 #にじさんじ念能力 詳細は下記！ 【この配信は…】 月ノ美兎と社築がにじさんじライバーの「念能力」を勝手に予想しまくってニヤニヤ ...,2020-08-11T14:50:37Z
月ノ美兎,Yn7DnD9owLM,健全なギャルゲーです。【ときめきメモリアル2/月ノ美兎/にじさんじ】,俺の負けだよYoutube #みとの生放送 前→https://www.youtube.com/watch?v=zKCGt7k7Naw.,2020-08-08T09:50:49Z
月ノ美兎,zKCGt7k7Naw,多くの人生を狂わせた伝説のギャルゲーやる【ときめきメモリアル2/にじさんじ/月ノ美兎】,見せてもらおうか…（ﾎﾟｷ…ﾎﾟｷ…） #みとの生放送 配信告知とかのツイッター https://twitter.com/MitoTsukino.,2020-08-07T14:44:23Z
月ノ美兎,-5LUC2QwSC4,話お～～～～ん！！！！【今後の企画とか別の話とか/にじさんじ】,みとの生放送 今後の企画（2個ぐらい）とかシャニマスの担当とかどう森でみんなが作ってくれた島とかほかの雑談とか ツイッター https://twitter.com/MitoTsukino.,2020-08-05T13:15:36Z
月ノ美兎,z9neNilEh3E,世界一怖い電車を見ましょう【幽霊列車】【にじさんじ/月ノ美兎】,見ましょう って何？ https://twitter.com/MitoTsukino.,2020-08-04T13:46:10Z
月ノ美兎,c4l34dDW7sQ,惡の華ED「花 -a last flower-」(全部美兎)OFF KARAOKE,アーティスト名：ASA-CHANG&巡礼 バイオリンのような何か：月ノ美兎 ベースのような何か：月ノ美兎 その他：月ノ美兎 みんな是非歌ってみてね！,2020-08-02T11:09:14Z
月ノ美兎,a5vHzfOSIQs,夏だしクセのありそうな乙女ゲームでもやるか…【にじさんじ/月ノ美兎】,人生初の乙女ゲームなのでめちゃくちゃ知識吸収するよ #みとの生放送.,2020-08-01T14:05:17Z
月ノ美兎,p9-HvT7neew,チュルリラ・チュルリラ・ダッダッダ！／和田たけあき(くらげP) coverd by 月ノ美兎,教室の支配者はわたくしだッ！！ ▽歌わせていただいた曲 https://www.youtube.com/watch?v=_j0kfGNwIlw 作詞・作曲・編曲 : 和田たけあき(くらげP)さま ▽MIX YABさま ...,2020-07-31T11:00:10Z
月ノ美兎,qAGVZYkIxc8,灯織を初P、そして「W.I.N.G.」最終回へ【シャニマス/月ノ美兎/にじさんじ】,わたくしはシャニマスが大好き！！！！ #みとの生放送 ツイッター https://twitter.com/MitoTsukino.,2020-07-29T15:30:26Z
月ノ美兎,UeFzDPDRODA,【夜廻】激かわホラゲ最後まで突っ走る #最終回【月ノ美兎/にじさんじ】,夜廻しか勝たん（ぷぅ！） #みとの生放送.,2020-07-28T13:55:27Z
月ノ美兎,cuMtHz-QfZw,全国股間オープン模試 supported by デリケアエムズ,提供：デリケアエムズ https://www.ikedamohando.co.jp/delicare_ms/ デリケアエムズの購入方法 Amazon・楽天等の各種オンラインストア 全国の薬店・薬局・ドラッグ ...,2020-07-27T13:13:00Z
月ノ美兎,h5eU1sla7ME,出不精が推奨される時代にせめて燃焼する【リングフィットアドベンチャー】,はい一流ラッパー #みとの生放送.,2020-07-25T05:09:29Z
月ノ美兎,ltzTT39Hnuk,【夜廻】ありえんカワイイと噂のホラゲやる【月ノ美兎/にじさんじ】,夜廻しか勝たん（ぷぅ！） #みとの生放送.,2020-07-23T14:01:01Z
月ノ美兎,b6wV1DC0_zM,【告知あり！】雑談とかをするよ～～～ッ！！！【月ノ美兎/にじさんじ】,超うれしいおしらせある！！！！！！！！ #みとの生放送.,2020-07-22T14:26:35Z
月ノ美兎,VA4CFL4nHjo,あまりに陰鬱な世界観で社畜を導くゲームやる【月ノ美兎/Mosaic/にじさんじ 】,彼が最後に見るのは、光か、ワイ将か #みとの生放送.,2020-07-21T15:49:50Z
月ノ美兎,eBkfXm8_Vwc,ミスったらリョナゲーになるらしいけどミスらないからリョナりません【やばたにえん/月ノ美兎/にじさんじ】,ミスらないからリョナりません 月ノ美兎にリョナ趣味もありません #みとの生放送.,2020-07-20T14:27:32Z
