streamer_name,videoId,title,description,publishedAt
森中花咲,oeVOSrGguLY,リスナー「今までよく生きてこれたな…」近況報告回【森中花咲/にじさんじ所属】,思わず「今までよく生きてこれたな…」とこぼれてしまうくらいどうしようもないことばかり起こったっていう近況報告 歌ってみたの裏話とかもしたいんごな サムネイルイラスト: ...,2020-11-02T11:09:56Z
森中花咲,1WzMAcRqZLc,アブソリュート ギルザレンⅢ世×剣持刀也×カザキ様 cover,原曲：YASUHIRO(康寛) https://youtu.be/waKONiYYouU https://twitter.com/yasuhiro_vanq ギル：お屋敷の執事。何百年もの間、誰もいないお屋敷を守ってきた。,2020-10-31T10:00:13Z
森中花咲,aaVfHgViS6I,【歓喜】【3年目のヴァンパイアカザキ様】【歌枠】,高貴なるヴァンパイアカザキ様が今年もやってきたぞ！！！！！！！！！！！！！！！！ 喜べ眷属達よ！！！！！！！！！ 概要欄後程編集する 誰だよと言う者は10分 ...,2020-10-29T16:21:00Z
森中花咲,gmfyWn2wlLA,【APEX】プラチナは目の前に！シーズン終了まであと11日【森中花咲/にじさんじ所属】,(前シーズン)プラチナ４→(前回)シルバー２→(現在)ゴールド1 FPS初心者が１から始めるAPEX生活！ えるっちゃんとやるよ～！ バンガの練習 ランクまわす予定 たまに他 ...,2020-10-24T11:13:06Z
森中花咲,epzIi5b7y8I,森中花咲という女【森中花咲/にじさんじ所属】,森中花咲とはこういう人物です。 ハロウィンボイス2020が発売中！買ってよ(10/31(土)まで) ☞https://nijisanji.booth.pm/items/2449170 ...,2020-10-23T16:46:57Z
森中花咲,Vi0VmupV0gM,【APEX】プラチナまでもう少し！バンガ使いの人来て…泣【森中花咲/にじさんじ所属】,(前シーズン)プラチナ４→(前回)シルバー２→(現在)ゴールド2 FPS初心者が１から始めるAPEX生活！ サムネイルイラスト:アカバネさん(@akabane22) バンガの練習 ランク ...,2020-10-23T08:18:14Z
森中花咲,pus1zq2fUyo,【APEX】バンガでランク！プラチナまであと一歩【森中花咲/にじさんじ所属】,(前シーズン)プラチナ４→(前回)シルバー２→(現在)ゴールド3 FPS初心者が１から始めるAPEX生活！ 16時頃からえるっちゃんとランク バンガの練習 ランクまわす予定 ...,2020-10-22T10:01:42Z
森中花咲,qAakHCzr0LY,エウテルぺ／森中花咲(cover),名もなき者のため 原曲：EGOIST 唄：森中花咲 https://www.youtube.com/channel/UCtpB6Bvhs1Um93ziEDACQ8g http://twitter.com/KazakiMorinaka イラスト：吉田ば ...,2020-10-18T10:00:10Z
森中花咲,uWY4ZZAlX6s,【APEX】えるかざガクしか勝たん！！！！！！【森中花咲/にじさんじ所属】,え！！！この三人で戦えるんですか！？ える視点☞https://www.youtube.com/watch?v=jZwsCAH1bvQ ガクくん ...,2020-10-17T09:32:16Z
森中花咲,eRfqKum0ok4,【ボロ負け/トレバ】病んだ【森中花咲/にじさんじ所属】,まぁ神頼みっすけどねぇ… かざと結婚したい子はこちら(10/16まで)☞https://nijisanji.booth.pm/items/2351525 サムネイルイラスト:221(ﾂﾂｲﾁ)さん(@221EX) スポンサー ...,2020-10-16T09:58:17Z
森中花咲,vp8NajoS6Kc,【Healin/癒し】海辺で雑談しましょう【森中花咲/にじさんじ所属】,癒される声と話をするとは言ってない※ かざと結婚したい子はこちら(10/16まで)☞https://nijisanji.booth.pm/items/2351525 サムネイルイラスト:かにかま ...,2020-10-16T04:23:16Z
森中花咲,mEGarEf0aYM,６ヶ月ぶりの雑談配信【森中花咲/にじさんじ所属】,まじか 雑談配信って名目の配信、そんなやってないん？ 前回は６ヶ月前の追加難波公演振り返り配信だとよ かざと結婚したい子はこちら(10/16 ...,2020-10-09T01:34:24Z
森中花咲,2b2vnsycEms,【APEX】関係性オタクえるかざがバンロバにキャッキャッしながら戦います【森中花咲/にじさんじ所属】,えるかざバンロバは最強 コスおじちゃんがかわゆすぎて辛い える視点☞https://www.youtube.com/watch?v=elDfi249S8I ≪APEX≫ 【FPSを始めた時期ときっかけ】 ...,2020-10-08T05:24:33Z
森中花咲,wDDAGJ9N7dY,【緊急企画】急遽二期生出身に招集かけたら何人集まるか？【にじさんじ所属】,切実に１人じゃありませんように…」 二年間表で集まることのなかった二期生出身メンバーを急遽招集かけたら何人集まるの？ そんな検証企画配信です。(許可済み) 【二 ...,2020-10-03T16:45:35Z
森中花咲,lJR8wST7Seo,【漫画】完全再現⁉ライバーに当てはめたら超シュールなタワテラになった！【ちびかざシリーズ】,【公式】森中花咲漫画シリーズ、名称≪ちびかざ≫！ 今回はソロ配信回です。 初期頃のタワテラ再現をライバーさんに役職を当てはめて漫画にしました！ 次回の投稿もお ...,2020-10-03T09:00:17Z
森中花咲,33MdMfBp61c,【APEX】朝からプラチナ目指して大砲打ちまくるわよ→途中からコラボ【森中花咲/にじさんじ所属】,(前回)プラチナ４→(現在)シルバー２ FPS初心者が１から始めるAPEX生活！ バンガの練習 ランクやったりカジュやったりえぺを楽しむ予定 たまに他キャラもやってみるかも ...,2020-10-02T06:33:23Z
森中花咲,gpj73FrOrJc,ダーリンダンス／森中花咲(cover),原曲：かいりきベア https://www.youtube.com/watch?v=Rkrm5foi188 唄：森中花咲 https://www.youtube.com/channel/UCtpB6Bvhs1Um93ziEDACQ8g ...,2020-09-25T10:45:12Z
森中花咲,-5YPgUx3nFM,【APEX】朝から大砲打ちまくるわよ【森中花咲/にじさんじ所属】,FPS初心者が１から始めるAPEX生活！ バンガの練習 ランクやったりカジュやったりえぺを楽しむ予定 たまに他キャラもやってみるかも？ ≪APEX≫ 【FPSを始めた時期と ...,2020-09-25T01:30:42Z
森中花咲,uJa1eS1utjg,光るなら／翔花咲明那サラ刀也とこ(cover)【#にじさんじアオハル部】,僕らの春がきた！ 原曲：Goose house https://www.youtube.com/watch?v=IeJTNN8_jLI 唄 戌亥とこ ...,2020-09-20T11:00:11Z
森中花咲,Wk2sOt9yWPE,【APEX】私の名前は森中・バンガ・花咲【森中花咲/にじさんじ所属】,バンガの練習 ランクやったりカジュやったりえぺを楽しむ予定 たまに他キャラもやってみるかも？ サムネイルイラスト:山吹色さん(@bukiiro) ≪APEX≫ 【FPSを始めた時期 ...,2020-09-20T06:24:43Z
森中花咲,ZxNTFx90Z7I,【APEX】バンガでもっと強くなりたい！【森中花咲/にじさんじ所属】,バンガの練習 ランクやったりカジュやったりえぺを楽しむ予定 たまに他キャラもやってみるかも？ サムネイルイラスト:Ｉｘｙ（いくしー）さん(@Ixy) ≪APEX≫ 【FPSを始めた時期 ...,2020-09-19T06:30:11Z
森中花咲,0LvWUD-OKD0,【APEX】えるかざがバンロバで、バンロバがえるかざ【森中花咲/にじさんじ所属】,"えるかざとバンロバ あると思います。 ≪APEX≫ 【FPSを始めた時期ときっかけ】 今年(2020年)の5月の下旬から始めました！ FPSもAPEXが初めてです。 そう、""ド""初心者 ...",2020-09-18T16:45:11Z
森中花咲,uh2GMPDpH20,【APEX】遂にえぺ配信！今まで貯めてた111パックガチャ引いていいっすか？【森中花咲/にじさんじ所属】,プラチナになったらえぺ配信していいという枷をつけて三か月。 遂に達成できました！！！！！！！ やったあああああああああああああああああああああああああああ ...,2020-09-18T12:49:26Z
森中花咲,uzbNv-DOack,【新衣装お披露目】一緒にデートしよ？【森中花咲/にじさんじ所属】,久しぶり！おかげさまで元気もりもりになって戻って参りました そして今日はくまさんの日！ 待ってくれたリスナーさん達とお祝いと感謝の意味を込めて新しいお洋服でデート ...,2020-09-03T11:57:54Z
森中花咲,O45fcSdFdFs,【漫画】大パニック！二人羽織でVRホラゲー実況は大波乱の連続…⁉【ちびかざシリーズ】,【公式】森中花咲漫画シリーズ、名称≪ちびかざ≫！ 今回はコラボ回です。 江良ちゃんとのユニット≪petit fleurs(ぷちふる)≫の二人で3Dコラボをした際の二人羽織ホラゲー ...,2020-08-28T10:45:01Z
森中花咲,6dwXuU_uIxI,８分でわかる森中花咲の煩悩【公式】,NOエロ！YESスケベ！ 煩悩が露呈しました。 こちら公式切り抜きです 元動画☞https://youtu.be/C-wDOvu99ro サムネイルイラスト:えるめんとさん(@elument00) 切り抜き ...,2020-08-23T12:00:01Z
森中花咲,mqbO-uC3mEM,わたしたち７さいになったよ！【#がんばれ7さい】,きょうはいつもいそがしいお兄ちゃんとお姉ちゃんとあそぶ日♡ でもあってあそんじゃだめなんだってーーーーママのケチ！ でもわたしたちとたっっっくさんあそぼうね☆ あと ...,2020-08-16T16:25:04Z
森中花咲,1WFOD_lX31c,【漫画】悶絶！負けヒロイン森中花咲は完全にやられました【ちびかざシリーズ】,【公式】森中花咲漫画シリーズの投稿を始めました…！ 名称は≪ちびかざ≫です！ 次回の投稿もお楽しみに！ チャンネル登録&高評価よろしくお願いします！,2020-08-14T11:12:43Z
森中花咲,vuegPkLt5l0,ごめんね ごめんね／森中花咲(cover),パパ 原曲：きくお https://youtu.be/I1mOeAtPkgk 唄：森中花咲 https://www.youtube.com/channel/UCtpB6Bvhs1Um93ziEDACQ8g http://twitter.com/KazakiMorinaka ...,2020-08-10T10:00:11Z
森中花咲,hH1aWqqK-ak,【真のかざ虐】リスナーに無理やり○○された結果……【森中花咲/にじさんじ】,公式切り抜き、始めました。 元動画☞https://youtu.be/MPCKeObRQ5k 切り抜き担当☞けんたろさん(@Kentaro_niji_ki) ...,2020-07-10T09:00:27Z
森中花咲,pQDG7Te1S0k,ヴィーナスとジーザス / 森中花咲 (petit fleurs)【cover】,『あなたに出会う、5分前＿』 ヴィーナスとジーザス／森中花咲 作詞・作曲：ティカα Retrack：立山健彦 Original Artist:やくしまるえつこ ...,2020-07-07T11:00:13Z
森中花咲,MPCKeObRQ5k,【マリオメーカー2】今度こそかざ虐民号泣！マッチングしてきた視聴者をボコボコにしますｗ【森中花咲/にじさんじ所属】,マッチング出来たら手加減なしでボコっていいよｗ マッチング出来たらだけどね(マッチングされない内に3勝しないと…) サムネイルイラスト:ゆあまさん(@maymaymay7523) ...,2020-06-27T11:29:30Z
森中花咲,ZmFuqKZRvyU,エイリアンズ ／森中花咲(cover),泣かないで ダーリン 原曲：キリンジ https://youtu.be/w05Q_aZKkFw 唄：森中花咲 https://www.youtube.com/channel/UCtpB6Bvhs1Um93ziEDACQ8g ...,2020-06-26T11:00:12Z
森中花咲,h-5xYs7-9d4,【大乱闘スマッシュブラザーズSPECIAL】かざ虐民号泣！初心者だけど視聴者ボコってみるｗ【森中花咲/にじさんじ所属】,一年ぶりにスマブラやります キャラ開放してないほど初心者です 手加減なしでボコりに来て下さい！ サムネイルイラスト:ゆあまさん(@maymaymay7523) スポンサー登録は ...,2020-06-25T12:29:16Z
森中花咲,qd9BIm-DjC4,【世界のアソビ大全51】負けた方は叙々苑奢りな！！！！！【森中花咲/本間ひまわり】,かざひまはガチ(本気でボッコボコにやり合う) ひっっっっっっっっっっっっっさびさのかざひまコラボ ひー ...,2020-06-23T05:15:02Z
森中花咲,P47TLXSlB1I,【世界のアソビ大全51】5回負けたら罰ゲーム！まぁ負けませんけど【森中花咲/にじさんじ所属】,これで負けたら明日のかざひまアソビ大全コラボでぼろ負け確定 サムネイルイラスト:ゆあまさん(@maymaymay7523) 恋人疑似体験サービスボイスはこちら(6/23まで！),2020-06-22T11:24:21Z
森中花咲,6tU74qEiAyg,【マイクラ】うるせェ！！！やろう！！！どんっ！【森中花咲/にじさんじ所属】,まだまだにじさんじ鯖を盛り上げたい！ マイクラ流行らせ隊代表、森中花咲より サムネイルイラスト:またのんき▽さん(@kinnotamadx) スポンサー登録はこちら(ファンクラブ ...,2020-06-21T12:29:49Z
森中花咲,C-wDOvu99ro,【お絵かき心理テスト】えっちな問題を先に予想しフラグ回避して、視聴者が全くはかどらない結果にするｗｗ【森中花咲/にじさんじ所属】,様々なVtuberがこのテストのえっちな回答で困った経験があると思います。 しかしわたしは予測し困りません。 よって切り抜かれません。 普通にお絵かき心理テスト楽しもう ...,2020-06-20T15:27:56Z
森中花咲,27Pd2LIwc2o,【行方不明】イヒヒヒヒｗイヒッ！イヒヒヒヒヒヒヒヒ２【森中花咲/伏見ガク】,タイトル名はただのガクくんの笑い声です(2回目) ホラゲー苦手意識克服にまたチャレンジします お助け ...,2020-06-19T12:05:49Z
森中花咲,GApZ2_nW9CA,【3Dコラボ】宇宙一可愛い配信にしろ(※閲覧注意)【森中花咲/御伽原江良】,アイドルならば常に可愛くあるべし！！！！！！ 二人で様々なミッションを乗り越えろ！ 御伽原 ...,2020-06-18T13:01:17Z
森中花咲,Ge5rbQAWfak,【激レア】17万人突破しても歌配信！再チャレンジ！【森中花咲/にじさんじ所属】,15万人記念の時は秒で終わった 今回もがんばるぞー！おー！ サムネイルイラスト:ゆあまさん(@maymaymay7523) 恋人疑似体験サービスボイスはこちら(6/23まで！),2020-06-17T10:06:44Z
森中花咲,1HPDCOLYT3I,キミに手料理をふるまってもいいかな…？【森中花咲/にじさんじ所属】,料理配信「ピーマンの肉詰め」 サムネイルイラスト:アカバネさん(@akabane22) おやすみボイスが期間限定で発売中！買いなさいな(6/11(木)23:59まで) ...,2020-06-07T11:14:03Z
森中花咲,qD-2zFQaXAg,【朝配信】帰ってきた！久々のマミー森中！【森中花咲/にじさんじ所属】,あのマミー森中が帰ってきた！！！！！！ 朝、家事をします。 夕方は料理配信予定 サムネイルイラスト:ゆあまさん(@maymaymay7523) おやすみボイスが期間限定で ...,2020-06-07T03:15:51Z
森中花咲,74DV1ZXYyrU,メルヘン彼氏とメルヘン彼女／鈴谷アキ×森中花咲(cover),え？あれから闇堕ちしたん？？ 前回の歌☞https://nico.ms/sm33618334 原曲：Nem https://youtu.be/wf_CKlDEMWo https://twitter.com/Nem_P 唄 鈴谷アキ ...,2020-06-03T11:00:12Z
森中花咲,BTogHiSA5-U,だめにんげんだ！ ／森中花咲(cover),だめだめだよ。 原曲：薄塩指数 https://youtu.be/c-SOJsITLLs https://twitter.com/usushioshisuu 唄：森中花咲 ...,2020-05-31T11:00:12Z
森中花咲,SKhx3HIeQSA,【マイクラ】マイクラ流行らせ隊！夜にソロやるの初めてじゃん！【森中花咲/にじさんじ所属】,死んだようにえぺしてた またにじさんじ鯖を盛り上げたい！ マイクラ流行らせ隊代表、森中花咲より スポンサー登録はこちら(ファンクラブサービス) ...,2020-05-29T12:11:31Z
森中花咲,nILAka__cKU,【誕生日記念】リモート通話で逆凸企画&amp;にじ3Dお披露目配信【森中花咲/にじさんじ所属】,5/23は森中花咲の誕生日 お誕生日おめでとう配信です！ 日頃お世話になったライバーさんとたくさんお話ししたいと思います。 後一年越しのにじ3Dお披露目をするよ～ 恋人 ...,2020-05-23T13:50:20Z
森中花咲,NoY1cxeyxWk,【マイクラ】マイクラ流行らせ隊！お久！ソロマイクラ！【森中花咲/にじさんじ所属】,こちら本来12時からやる予定だった枠 またにじさんじ鯖を盛り上げたい！ 建築したいからネザーへ行くわ！ マイクラ流行らせ隊代表、森中花咲より サムネイルイラスト: ...,2020-05-21T10:27:47Z
森中花咲,oWukP15fXoA,【雀魂】あれ？またあがっちゃいました？視聴者参加型麻雀大会【森中花咲/にじさんじ所属】,あら、またロンです！ サムネイルイラスト:日比谷色さん(@hibiyairo) スポンサー登録はこちら(ファンクラブサービス) ...,2020-05-20T12:14:44Z
森中花咲,G2MywCiRwH4,【朗報(個人的)】にじ鯖探検コラボ！【森中花咲/にじさんじ所属】,マイクラコラボ誘われた…………………………！泣 ながおけい☞https://www.youtube.com/channel/UCXW4MqCQn-jCaxlX-nn-BYg ういは ...,2020-05-19T12:57:21Z
