streamer_name,videoId,title,description,publishedAt
花畑チャイカ,GZCyh4Zo5cM,花畑チャイカとペーパーマリオオリガミキングゲイナー毎回ここに折紙あるあるを書いていたんだけどそんなねえよ折紙食っちゃうやつとかいるよねいねえよ,灰かぶり朗読 https://shop.nijisanji.jp/s/niji/item/detail/dig-00125?ima=0323 色んなの再販中 https://shop.nijisanji.jp/s/niji/item/detail/dig-00085?ima=4123 ...,2020-10-30T16:29:35Z
花畑チャイカ,8sJB5UuwwZE,花畑チャイカと現代ポケモン研究家 前回のあらすじヤロー！ぶっ倒してやったッピ！,灰かぶり朗読 https://shop.nijisanji.jp/s/niji/item/detail/dig-00125?ima=0323 色んなの再販中 https://shop.nijisanji.jp/s/niji/item/detail/dig-00085?ima=4123 ...,2020-10-28T17:08:24Z
花畑チャイカ,gSKvKuhhScU,花畑チャイカとスーパーマリオギャラクシー光を超えて宇宙へ宇宙の事そらって最初に言った人すごいよね,灰かぶり朗読 https://shop.nijisanji.jp/s/niji/item/detail/dig-00125?ima=0323 色んなの再販中 https://shop.nijisanji.jp/s/niji/item/detail/dig-00085?ima=4123 ...,2020-10-25T16:25:15Z
花畑チャイカ,oXBmIT5r4N8,花畑チャイカと真夜中のポケモン研究家配信4回目ジムバッジ0 DLCが早くやりたい,灰かぶり朗読 https://nijisanji.booth.pm/items/2399722 色んなの再販中 https://shop.nijisanji.jp/s/niji/item/detail/dig-00085?ima=4123 サムネイル まる.,2020-10-24T18:43:20Z
花畑チャイカ,hPc6HYymFw0,花畑チャイカとスーパーマリオサンシャイン雨降りサーカス最終決戦！え？ここで終わるんですか？いいえ私にかかればどんなゲームもエンドコンテンツ,灰かぶり朗読 https://nijisanji.booth.pm/items/2399722 色んなの再販中 https://shop.nijisanji.jp/s/niji/item/detail/dig-00085?ima=4123 サムネイル まる.,2020-10-24T16:13:07Z
花畑チャイカ,gKIB3JX1oBs,花畑チャイカとダウンロードコンテンツと共に帰ってきたポケモン研究家ただいまジムバッジ0個DLCをやるのは果たしていつになるのだろうかなぜ皆がポケモンやりだすタイミングで帰ってきてしまったのか,灰かぶり朗読 https://nijisanji.booth.pm/items/2399722 色んなの再販中 https://shop.nijisanji.jp/s/niji/item/detail/dig-00085?ima=4123 サムネイル やかん.,2020-10-23T16:52:39Z
花畑チャイカ,4xMiIn0ETGg,花畑チャイカとF-ZERO GXスマブラですっごい殴ってくる人のゲームですそういえば僕たちはこのおじさんの事何も知らない　初見プレイ,一緒にお料理ボイス販売中 https://nijisanji.booth.pm/items/2435464 灰かぶり朗読 https://nijisanji.booth.pm/items/2399722 色んなの再販中 ...,2020-10-18T16:47:28Z
花畑チャイカ,cHmbF9-oYGA,花畑チャイカとスーパーマリオサンシャイン今週のジャンプは今日発売だよ,一緒にお料理ボイス販売中 https://nijisanji.booth.pm/items/2435464 灰かぶり朗読 https://nijisanji.booth.pm/items/2399722 色んなの再販中 ...,2020-10-16T18:01:58Z
花畑チャイカ,zlpKlm_9T3w,不眠を乗り越えた花畑チャイカとデュエルマスターズプレイスこんな時間に失礼ィィィ～眠れたけど生活リズムリズムスタイルさおかしなったよ,一緒にお料理ボイス販売中 https://nijisanji.booth.pm/items/2435464 灰かぶり朗読 https://nijisanji.booth.pm/items/2399722 色んなの再販中 ...,2020-10-15T20:19:30Z
花畑チャイカ,C_3eWSwrucg,舞元力一VS内股がに股！3Dツイスター！ドキッ！おじさんだらけの運動会！タマタマもあるよ。ついでにいちからの新技術もあるよ　花畑チャイカ　社築　ジョー力一　舞元啓介,築 https://www.youtube.com/channel/UCKMYISTJAQ8xTplUPHiABlA ジョー https://www.youtube.com/channel/UChUJbHiTVeGrSkTdBzVfNCQ 啓介 ...,2020-10-05T12:35:07Z
花畑チャイカ,P-X8tb09jx0,花畑チャイカとペーパーマリオオリガミキングゥすっごい久しぶり千羽鶴！千羽鶴！ずっと折ってる！千羽鶴！,朗読灰かぶり姫販売中 https://nijisanji.booth.pm/items/2399722 お月見ボイス販売中 https://nijisanji.booth.pm/items/2377492 看病ボイス再販中 ...,2020-09-30T13:47:35Z
花畑チャイカ,8_ON17SEqIM,花畑チャイカと社築の1‐2‐Switch 3D,社 https://www.youtube.com/channel/UCKMYISTJAQ8xTplUPHiABlA サムネイル はなまみらん.,2020-09-28T11:50:56Z
花畑チャイカ,NyZ1khMr0Yc,花畑チャイカとスーパーマリオサンシャイン！ゲームキューブよ私は帰ってきた！スイッチで遊べるようになってサンシャインが難しいと言うことが皆に分かってもらえたようで嬉しいねもう二度と馬鹿にするなよ？,朗読灰かぶり姫販売中 https://nijisanji.booth.pm/items/2399722 お月見ボイス販売中 https://nijisanji.booth.pm/items/2377492 看病ボイス再販中 ...,2020-09-26T17:14:04Z
花畑チャイカ,bqXcy1lTbtI,花畑チャイカとスーパーマリオ3Dコレクションのスーパーマリオサンシャインがゲームキューブのスーパーマリオサンシャインとどれだけ違うか確認したり64やったりギャラクシー触っちゃったりするかもしれない回,朗読灰かぶり姫販売中 https://nijisanji.booth.pm/items/2399722 お月見ボイス販売中 https://nijisanji.booth.pm/items/2377492 いろんなの再販中 ...,2020-09-25T16:17:25Z
花畑チャイカ,JODS3z-8C28,花畑チャイカと聖闘士星矢ライジングコスモ　えっ⁉ア〇トークとぐ〇ぐだ妖精sと黄金聖衣のフィギュアの知識しかない私でも楽しめるアプリがあるんですか？聖闘士星矢最高！,提供：『聖闘士星矢 ライジングコスモ』 ▽ダウンロードはこちら！今ならリリース記念として、最大無料１００連召喚（ガチャ）をゲット！（※配信日時点） https://bit.ly/2RyRyZP ...,2020-09-22T11:51:36Z
花畑チャイカ,K8aDhDw9Qwk,花畑チャイカとMTG ミーティングじゃあないぜマジックザギャザリングだアーリーアクセスゼンディカーだっけゼンディガーだっけってなるよねゼンディカーライジング,いろんなの再販中 https://shop.nijisanji.jp/s/niji/item/detail/dig-00085?ima=4123 【再販】ホワイトデーボイス2020 https://nijisanji.booth.pm/items/2347151 【再販】学園 ...,2020-09-17T08:18:49Z
花畑チャイカ,k4o6jF10oBQ,花畑チャイカとMTG ミーティングの事MTGって書くのやめてくださいワクワクしちゃうだろアーリーアクセス時々社！合流したり一人で遊んだりするぜよゼンディカーの夜明けぜよ,いろんなの再販中 https://shop.nijisanji.jp/s/niji/item/detail/dig-00085?ima=4123 【再販】ホワイトデーボイス2020 https://nijisanji.booth.pm/items/2347151 【再販】学園 ...,2020-09-16T17:38:17Z
花畑チャイカ,HWK7PE5OgaU,花畑チャイカとえっ！あの9月18日金曜日発売のマリオ3Dコレクションに入ってるスーパーマリオサンシャインを今日やるんですか⁉出来らぁ‼,いろんなの再販中 https://shop.nijisanji.jp/s/niji/item/detail/dig-00085?ima=4123 【再販】ホワイトデーボイス2020 https://nijisanji.booth.pm/items/2347151 【再販】学園 ...,2020-09-14T17:09:09Z
花畑チャイカ,GiSDWC4vwU4,花畑チャイカと最近色々あったんでね雑談しようと思いますけどついでに良いサムネ見つけたんでお悩み相談しちゃおうかなただじゃないけどね最近野球好き！ゴーゴー!ゴジラッ!!マツイくんとかっとばせ!キヨハラく,【再販】ホワイトデーボイス2020 https://nijisanji.booth.pm/items/2347151 【再販】学園祭ボイス2019 https://nijisanji.booth.pm/items/2361157 9月のボイス販売中 ...,2020-09-11T19:50:56Z
花畑チャイカ,T6pQB8EdkB4,花畑チャイカと#APEX部2434キルリレー にじさんじレジスタンス(株) タイトルで喋るの内容わかんないからやめた方がいいって言うけど最近は最初にやる事書いてあるから大丈夫なんだよとーま,椎名 https://www.youtube.com/channel/UC_4tXjqecqox5Uc05ncxpxg 夜見 https://www.youtube.com/channel/UCL34fAoFim9oHLbVzMKFavQ 怪談ボイス販売中 ...,2020-09-08T17:01:01Z
花畑チャイカ,L-u4rBtw-QA,花畑チャイカと#APEX部2434キルリレー にじさんじレジスタンス(株) 信じて,椎名 https://www.youtube.com/channel/UC_4tXjqecqox5Uc05ncxpxg 夜見 https://www.youtube.com/channel/UCL34fAoFim9oHLbVzMKFavQ 怪談ボイス販売中 ...,2020-09-05T15:41:19Z
花畑チャイカ,WVafA2LPmwY,花畑チャイカとマインクラフト久しぶりに雑談して観光しましょうかね,怪談ボイス販売中 https://nijisanji.booth.pm/items/2308885 9月のボイス販売中 https://nijisanji.booth.pm/items/2323023 サムネイル 呑むヨーグルトさん 音楽 1行目 2 ...,2020-09-03T20:09:57Z
花畑チャイカ,7k25QikWxG0,3DでARMS！故にダイレクトアタック可！最後まで立っていた者が勝者だ！レバガチャイカダイエスタ　花畑チャイカ　社築　笹木咲　リゼ・ヘルエスタ,レバガチャイカダイエスタ 笹木 https://www.youtube.com/channel/UCoztvTULBYd3WmStqYeoHcA リゼ ...,2020-09-01T13:46:01Z
花畑チャイカ,JB4PPsSUo4A,花畑チャイカとARKあべれーしょん今度こそVS地獄の触手おじさん2,怪談ボイス販売中 https://nijisanji.booth.pm/items/2308885 8月のボイス販売中 https://nijisanji.booth.pm/items/2234468 サムネイル やかんさん 音楽 1行目 2行目 3行 ...,2020-08-31T12:17:06Z
花畑チャイカ,CyLKSq4Yj-k,花畑チャイカとARKあべれーしょん多分VS地獄の触手おじさん,怪談ボイス販売中 https://nijisanji.booth.pm/items/2308885 8月のボイス販売中 https://nijisanji.booth.pm/items/2234468 サムネイル やかんさん 音楽 1行目 2行目 3行 ...,2020-08-30T17:22:01Z
花畑チャイカ,qSyFZ8RdyT4,花畑チャイカとほんとすみませんARKですあべれーしょん　サムネのコイツ仲間にしようかな,怪談ボイス販売中 https://nijisanji.booth.pm/items/2308885 8月のボイス販売中 https://nijisanji.booth.pm/items/2234468 サムネイル めじろさん 音楽 1行目 2行目 3行 ...,2020-08-29T18:27:46Z
花畑チャイカ,-lQSbEy7YBw,にじさんじ最狂最強最恐最凶マリオ四天王が一番難しいと言われるマリオ2をクリアする3D配信 罰ゲームもあるよ！出番はないだろうがね,憤怒の椎名 https://www.youtube.com/channel/UC_4tXjqecqox5Uc05ncxpxg 嘆きのでびる https://www.youtube.com/channel/UCjlmCrq4TP1I4xguOtJ-31w 私は ...,2020-08-27T13:10:24Z
花畑チャイカ,ba81TlzOh2A,花畑チャイカとARKアベレチオンお待ちかね遅れてきた役立たずの時間だよ,怪談ボイス販売中 https://nijisanji.booth.pm/items/2308885 8月のボイス販売中 https://nijisanji.booth.pm/items/2234468 サムネイル めじろさん 音楽 1行目 2行目 3行 ...,2020-08-25T17:43:54Z
花畑チャイカ,3rDNfZwft14,スマブラリベンジタッグマッチ！笹木咲&amp;魔界ノりりむVS社築&amp;花畑チャイカ　カジュアルっつってんだろ！,笹木 https://www.youtube.com/channel/UCoztvTULBYd3WmStqYeoHcA りりむ https://www.youtube.com/channel/UC9EjSJ8pvxtvPdxLOElv73w 社 ...,2020-08-23T14:26:21Z
花畑チャイカ,cQetNOGzvU8,花畑チャイカとARK 君のハートにアベレーション このタイトルきっと皆思いついたよね被ったら恥ずかしいなへへっ,サムネイル めじろ.,2020-08-23T11:25:52Z
花畑チャイカ,eFhVfoOgKCo,ミス,笹木 https://www.youtube.com/channel/UCoztvTULBYd3WmStqYeoHcA りりむ https://www.youtube.com/channel/UC9EjSJ8pvxtvPdxLOElv73w 社 ...,2020-08-23T08:31:58Z
花畑チャイカ,UV8I0Sm1DEg,花畑チャイカとマインクラフトまちゅぴちゅぴちぴちまっちょなちゅまちゅり,悪役令嬢なので森のエルフを使用人にしました 一緒におさぼりボイス再販中 https://nijisanji.booth.pm/items/2291121 飲んだくれ介抱ボイス再販中 ...,2020-08-22T13:30:26Z
花畑チャイカ,D7BX7MCBVm0,ニンテンドー ラボ ロボットを社と加賀美と一緒に3Dで作って遊ぼう,社 https://www.youtube.com/channel/UCKMYISTJAQ8xTplUPHiABlA 加賀美 https://www.youtube.com/channel/UCmovZ2th3Sqpd00F5RdeigQ サムネイル とーお ...,2020-08-17T13:11:25Z
花畑チャイカ,E1zohxRfC38,花畑チャイカとfall guys 鷹宮と緑と,夏まつりボイス再販中 https://nijisanji.booth.pm/items/2274940 ヴァレンタインヴォイス再販中 https://nijisanji.booth.pm/items/2250661 8月のボイス販売中 ...,2020-08-15T15:02:09Z
花畑チャイカ,xH-9cmkGdJ8,花畑チャイカとペーパーマリオオリガミキングヌー　喋ることいっぱいあるぜ！って時に限ってメン限やっちゃって喋っちゃうのなんで,夏まつりボイス再販中 https://nijisanji.booth.pm/items/2274940 ヴァレンタインヴォイス再販中 https://nijisanji.booth.pm/items/2250661 8月のボイス販売中 ...,2020-08-13T15:26:05Z
花畑チャイカ,G7a8cGeVHSE,花畑チャイカと大乱闘スマブラ SPにじさんじ杯【#にじさんじ大乱闘】VS 笹木咲,ヴァレンタインヴォイス再販中 https://nijisanji.booth.pm/items/2250661 夏真っ盛りボイス再販中 https://nijisanji.booth.pm/items/2249096 8月のボイス販売中 ...,2020-08-09T12:50:15Z
花畑チャイカ,_0a7t2hGDw0,花畑チャイカと大乱闘スマブラ SPにじさんじ杯【#にじさんじ大乱闘】VS皇国に仕える官吏VΔLZ 弦月藤士郎,ヴァレンタインヴォイス再販中 https://nijisanji.booth.pm/items/2250661 夏真っ盛りボイス再販中 https://nijisanji.booth.pm/items/2249096 8月のボイス販売中 ...,2020-08-09T12:09:49Z
花畑チャイカ,7WkbFK3Ozhk,花畑チャイカと大乱闘スマブラ SPにじさんじ杯【#にじさんじ大乱闘】VS桜第一惑星王女桜妖精 桜凛月,ヴァレンタインヴォイス再販中 https://nijisanji.booth.pm/items/2250661 夏真っ盛りボイス再販中 https://nijisanji.booth.pm/items/2249096 8月のボイス販売中 ...,2020-08-09T11:09:00Z
花畑チャイカ,MRPnFeWN0sY,花畑チャイカと大乱闘スマブラ SPにじさんじ杯【#にじさんじ大乱闘】VSコーヴァス帝国女騎士フレン・E・ルスタリオ,ヴァレンタインヴォイス再販中 https://nijisanji.booth.pm/items/2250661 夏真っ盛りボイス再販中 https://nijisanji.booth.pm/items/2249096 8月のボイス販売中 ...,2020-08-09T09:41:38Z
花畑チャイカ,WxGHZJe7mUQ,花畑チャイカと大乱闘スマブラ SPにじさんじ杯【#にじさんじ大乱闘】VS魔王の子 魔界ノりりむ,ヴァレンタインヴォイス再販中 https://nijisanji.booth.pm/items/2250661 夏真っ盛りボイス再販中 https://nijisanji.booth.pm/items/2249096 8月のボイス販売中 ...,2020-08-09T05:44:33Z
花畑チャイカ,XDXNOBvjC00,花畑チャイカとペーパーマリオオリガミキングダム　あの～祭りで海外のーぶん殴ってぇ棒でー壊れて中身出るやつ～あれって折紙か？あれやりたいよねぇー,ヴァレンタインヴォイス再販中 https://nijisanji.booth.pm/items/2250661 夏真っ盛りボイス再販中 https://nijisanji.booth.pm/items/2249096 8月のボイス販売中 ...,2020-08-08T10:25:18Z
花畑チャイカ,VZHJnUjlxFo,花畑チャイカとゼルダの伝説夢をみる島　最終回なのかい？人の夢の話って面白くないよね自分でもしちゃうけど,ヴァレンタインヴォイス再販中 https://nijisanji.booth.pm/items/2250661 夏真っ盛りボイス再販中 https://nijisanji.booth.pm/items/2249096 8月のボイス販売中 ...,2020-08-06T17:50:11Z
花畑チャイカ,D108O-JcqKM,花畑チャイカとゼルダの伝説夢をみる島　ああ おれたちは皆 眼をあけたまま 空を飛ぶ夢を見てるんだ,ヴァレンタインヴォイス再販中 https://nijisanji.booth.pm/items/2250661 夏真っ盛りボイス再販中 https://nijisanji.booth.pm/items/2249096 8月のボイス販売中 ...,2020-08-03T18:31:08Z
花畑チャイカ,Ryfv09mvfXM,花畑チャイカとペーパーマリオオリガミシャーマンキング　ばあちゃんってチラシでゴミ箱折るよね,夏真っ盛りボイス再販中 https://nijisanji.booth.pm/items/2249096 8月のボイス販売中 https://nijisanji.booth.pm/items/2234468 待て ...,2020-08-01T17:05:44Z
花畑チャイカ,CQMgcX--ouA,花畑チャイカとペーパーマリオオリガミスピードキング　パックマンみたいなの折って占いするやつなんなの,夏真っ盛りボイス販売中 https://nijisanji.booth.pm/items/2218649 7月のボイス発売中 https://nijisanji.booth.pm/items/2168211 待て ...,2020-07-29T17:04:50Z
花畑チャイカ,58kJgf_pZ2o,花畑チャイカとペーパーマリオオリガミムーンキング　金と銀の折紙を勝ち取ったところで何も作れない,夏真っ盛りボイス販売中 https://nijisanji.booth.pm/items/2218649 7月のボイス発売中 https://nijisanji.booth.pm/items/2168211 サムネイル お粥さん 音楽 1行目 2行目 ...,2020-07-27T17:51:43Z
花畑チャイカ,g1k4tZf6Gvg,花畑チャイカとペーパーマリオオリガミカリフォルニアキングベッドちゃん　紙ヒコーキ作るのは誰よりもうまい鶴は折れない,夏真っ盛りボイス販売中 https://nijisanji.booth.pm/items/2218649 7月のボイス発売中 https://nijisanji.booth.pm/items/2168211 サムネイル 地主さん 音楽 1行目 2行目 ...,2020-07-25T16:23:00Z
花畑チャイカ,pxH1jEj8GZs,花畑チャイカとペーパーマリオオリガミキングオブハート　鶴の胴体に息を吹き込むバイトをしております,夏真っ盛りボイス販売中 https://nijisanji.booth.pm/items/2218649 7月のボイス発売中 https://nijisanji.booth.pm/items/2168211 サムネイル サラダさん 音楽 1行目 2行 ...,2020-07-23T17:18:28Z
花畑チャイカ,0jgu00lxrEo,花畑チャイカとペーパーマリオオリガミキングクリムゾンこれがほんとの紙ゲーってね,7月のボイス発売中 https://nijisanji.booth.pm/items/2168211 サムネイル はなまみらんさん 音楽 1行目 2行目 3行目 ------------------------------------------------ □活動 主に、 ...,2020-07-21T14:47:50Z
